{
  "schema_version": "1.0",
  "lease_id": "33333333-3333-4333-8333-333333333333",
  "run_id": "11111111-1111-4111-8111-111111111111",
  "lane_id": null,
  "owner": {"harness": "codex", "actor": "synthetic-agent", "session_id": "session-1"},
  "acquired_at": "2026-08-16T08:00:00Z",
  "renewed_at": "2026-08-16T08:01:00Z",
  "expires_at": "2026-08-16T08:06:00Z",
  "generation": 0
}
